{
  "eventId": "019bd655-3d44-7a65-8f76-e5f607182930",
  "occurredAt": "2026-09-11T07:48:55.2050000+00:00",
  "aggregateId": "019bd63b-6294-7e3c-9f57-607182930415",
  "organisationId": "019bcf7f-9d10-7b21-84c6-5e7f8a9b0c1d",
  "branchId": "019bcf7f-a204-7f38-9c52-6d7e8f90a1b2",
  "orderId": "019bd63b-5183-7d2b-8e46-5f6071829304",
  "garmentJobNumber": "J-CBE01-2627-000001-01",
  "workflowDefinitionId": "019bd5c1-95c7-7b6f-8280-93041526374a",
  "workflowVersionId": "019bd5c1-a6d8-7c70-9391-04152637485b",
  "eventType": "orders.job-entered-production.v1",
  "schemaVersion": 1
}
